"DESCRIPTION","DURATION IN MS","NAME","PARENT SUITE","START TIME","STATUS","STOP TIME","SUB SUITE","SUITE","TEST CLASS","TEST METHOD"
"Проверка получения списка автомобилей пользователя, у пользователя  нет автомобиля","6208","Получение списка автомобилей пользователя (у пользователя нет машины)","","2026-07-02","passed","2026-07-02","","tests.ui.user.UserTest","tests.ui.user.UserTest","readUserWithNoCar"
"Проверка создания пользователя с невалидными данными","673","API - Создание пользователя с невалидными данными Создание пользователя с невалидными данными - UserRq(id=null, age=32, firstName=Miguel, money=null, secondName=Hirthe, sex=FEMALE)","","2026-07-02","passed","2026-07-02","","tests.api.user.UserApiTest","tests.api.user.UserApiTest","createUserWithNullFields"
"Тест проверяет создание и последующее удаление автомобиля","1347","Удаление автомобиля","","2026-07-02","passed","2026-07-02","","tests.api.car.CarCrudTest","tests.api.car.CarCrudTest","deleteCarTest"
"","18582","checkSortingByNumericField(String) Сортировка автомобилей по полю ID","","2026-07-02","passed","2026-07-02","","tests.ui.car.CarSortTest","tests.ui.car.CarSortTest","checkSortingByNumericField"
"Тест проверяет создание автомобиля с дизельным двигателем (BMW X5)","1363","Создание дизельного автомобиля","","2026-07-02","passed","2026-07-02","","tests.api.car.CarCrudTest","tests.api.car.CarCrudTest","createDieselCarTest"
"Проверка начисления денег несуществующему пользователю","2068","API - Попытка начисления денег несуществующему пользователю","","2026-07-02","passed","2026-07-02","","tests.api.user.UserApiTest","tests.api.user.UserApiTest","addMoneyToNotExistingUser"
"Проверка получения списка автомобилей пользователя, у пользователя  несколько машин","18457","Получение списка автомобилей пользователя Получение списка автомобилей пользователя - машин у пользователя: 5","","2026-07-02","passed","2026-07-02","","tests.ui.user.UserTest","tests.ui.user.UserTest","readUserWithCars"
"Проверка переходов по основным разделам сайта","3264","checkOpeningPage(MenuOption) Проверка открытия страницы CARS_READ_ALL","","2026-07-02","passed","2026-07-02","","tests.ui.menu.MenuTest","tests.ui.menu.MenuTest","checkOpeningPage"
"Проверка начисления денег пользователю","2088","API - Начисление денег пользователю","","2026-07-02","passed","2026-07-02","","tests.api.user.UserApiTest","tests.api.user.UserApiTest","addMoneyToUser"
"Тест проверяет создание японского автомобиля (Toyota Camry)","1362","Создание японского автомобиля","","2026-07-02","passed","2026-07-02","","tests.api.car.CarCrudTest","tests.api.car.CarCrudTest","createJapaneseCarTest"
"Параметризованный тест проверяет обработку ошибок при создании автомобиля с некорректными данными: пустые значения, недопустимые типы двигателя, отрицательная цена, числовые значения в строковых полях","709","Создание автомобиля с невалидными данными [8] BMW, 123, Diesel, 10000","","2026-07-02","passed","2026-07-02","","tests.api.car.CarNegativeTest","tests.api.car.CarNegativeTest","createInvalidCarTest"
"Параметризованный тест проверяет обработку ошибок при создании автомобиля с некорректными данными: пустые значения, недопустимые типы двигателя, отрицательная цена, числовые значения в строковых полях","709","Создание автомобиля с невалидными данными [4] BMW, X5, Petrol, 10000","","2026-07-02","passed","2026-07-02","","tests.api.car.CarNegativeTest","tests.api.car.CarNegativeTest","createInvalidCarTest"
"Тест проверяет покупку автомобиля с недостаточными средствами","7708","Ошибка при покупке с недостаточными средствами","","2026-07-02","passed","2026-07-02","","tests.ui.car.BuyCarTest","tests.ui.car.BuyCarTest","buyCarWithInsufficientMoney"
"Проверка создания пользователя с невалидными данными","675","API - Создание пользователя с невалидными данными Создание пользователя с невалидными данными - UserRq(id=null, age=null, firstName=Annabelle, money=211705.86, secondName=Hirthe, sex=MALE)","","2026-07-02","passed","2026-07-02","","tests.api.user.UserApiTest","tests.api.user.UserApiTest","createUserWithNullFields"
"","5653","All POST - создание автомобиля","","2026-07-02","passed","2026-07-02","","tests.ui.allpost.AllPostTest","tests.ui.allpost.AllPostTest","createCarFromAllPostPage"
"Проверка получения списка автомобилей пользователя, у пользователя  несколько машин","13294","Получение списка автомобилей пользователя Получение списка автомобилей пользователя - машин у пользователя: 3","","2026-07-02","passed","2026-07-02","","tests.ui.user.UserTest","tests.ui.user.UserTest","readUserWithCars"
"Проверка получения имущества несуществующего пользователя","1645","API - Получение имущества несуществующего пользователя","","2026-07-02","passed","2026-07-02","","tests.api.user.UserApiTest","tests.api.user.UserApiTest","getNotExistingUserInfo"
"Проверка изменения пользователя","2266","API - Изменение пользователя","","2026-07-02","passed","2026-07-02","","tests.api.user.UserApiTest","tests.api.user.UserApiTest","changeUser"
"Проверка создания нового пользователя","1372","API - Создание нового пользователя","","2026-07-02","passed","2026-07-02","","tests.api.user.UserApiTest","tests.api.user.UserApiTest","createUser"
"Проверка получения списка пользователей","2242","API - Получение списка пользователей","","2026-07-02","passed","2026-07-02","","tests.api.user.UserApiTest","tests.api.user.UserApiTest","getUsers"
"Параметризованный тест проверяет обработку ошибок при создании автомобиля с некорректными данными: пустые значения, недопустимые типы двигателя, отрицательная цена, числовые значения в строковых полях","671","Создание автомобиля с невалидными данными [2] BMW, null, Diesel, 10000","","2026-07-02","passed","2026-07-02","","tests.api.car.CarNegativeTest","tests.api.car.CarNegativeTest","createInvalidCarTest"
"","1017","Получение дома по ID","","2026-07-02","passed","2026-07-02","","tests.api.house.HouseCrudTest","tests.api.house.HouseCrudTest","getHouseTest"
"Проверка сортировки списка пользователей","28625","checkSortingByTextField(String) Сортировка пользователей по полю First name","","2026-07-02","passed","2026-07-02","","tests.ui.user.UserTest","tests.ui.user.UserTest","checkSortingByTextField"
"Проверка добавления денег пользователю","5783","Добавление денег пользователю","","2026-07-02","passed","2026-07-02","","tests.ui.user.UserTest","tests.ui.user.UserTest","addMoney"
"Проверка отмены успешной авторизации с валидными данными","3002","Негативная авторизация с корректными кредами","","2026-07-02","passed","2026-07-02","","tests.ui.login.LoginTest","tests.ui.login.LoginTest","negativeLogin"
"Проверка создания пользователя с невалидными данными","666","API - Создание пользователя с невалидными данными Создание пользователя с невалидными данными - UserRq(id=null, age=55, firstName=null, money=366209.43, secondName=Kirlin, sex=FEMALE)","","2026-07-02","passed","2026-07-02","","tests.api.user.UserApiTest","tests.api.user.UserApiTest","createUserWithNullFields"
"Проверка изменения несуществующего пользователя","2041","API - Попытка изменения несуществующего пользователя","","2026-07-02","passed","2026-07-02","","tests.api.user.UserApiTest","tests.api.user.UserApiTest","changeNotExistingUserById"
"Тест параметризованный тест на создание автомобиля","2969","Создание автомобилей с разными параметрами [2] Diesel, BMW, X5, 200000","","2026-07-02","passed","2026-07-02","","tests.ui.car.CreateCarTest","tests.ui.car.CreateCarTest","createCarWithVariousData"
"Тест проверяет покупку автомобиля с достаточными средствами","7697","Успешная покупка автомобиля с достаточными средствами","","2026-07-02","passed","2026-07-02","","tests.ui.car.BuyCarTest","tests.ui.car.BuyCarTest","buyCarWithSufficientMoney"
"","6168","All POST - заселение пользователя в дом","","2026-07-02","passed","2026-07-02","","tests.ui.allpost.AllPostTest","tests.ui.allpost.AllPostTest","settleUserToHouseFromAllPostPage"
"","11169","Множественные покупки одним пользователем [2] 2","","2026-07-02","passed","2026-07-02","","tests.ui.car.BuyCarTest","tests.ui.car.BuyCarTest","multiplePurchasesByUser"
"Проверка переходов по основным разделам сайта","3245","checkOpeningPage(MenuOption) Проверка открытия страницы USERS_READ_ALL","","2026-07-02","passed","2026-07-02","","tests.ui.menu.MenuTest","tests.ui.menu.MenuTest","checkOpeningPage"
"Параметризованный тест проверяет обработку ошибок при создании автомобиля с некорректными данными: пустые значения, недопустимые типы двигателя, отрицательная цена, числовые значения в строковых полях","681","Создание автомобиля с невалидными данными [3] BMW, X5, null, 10000","","2026-07-02","passed","2026-07-02","","tests.api.car.CarNegativeTest","tests.api.car.CarNegativeTest","createInvalidCarTest"
"Проверка получения несуществующего пользователя","1647","API - Попытка получения несуществующего пользователя по id","","2026-07-02","passed","2026-07-02","","tests.api.user.UserApiTest","tests.api.user.UserApiTest","getNotExistingUserById"
"Проверка создания пользователя с невалидными данными","5092","Создание пользователя с невалидными данными Создание пользователя с невалидными данными - User(id=null, firstName=Flor, lastName=Grimes, age=55, sex=null, money=819553.36)","","2026-07-02","passed","2026-07-02","","tests.ui.user.UserTest","tests.ui.user.UserTest","createInvalidUser"
"Тест проверяет создание дорогого электромобиля (Tesla ModelX)","1366","Создание дорогого автомобиля","","2026-07-02","passed","2026-07-02","","tests.api.car.CarCrudTest","tests.api.car.CarCrudTest","createExpensiveCarTest"
"","5699","All POST - создание пользователя","","2026-07-02","passed","2026-07-02","","tests.ui.allpost.AllPostTest","tests.ui.allpost.AllPostTest","createUserFromAllPostPage"
"Проверка переходов по основным разделам сайта","3283","checkOpeningPage(MenuOption) Проверка открытия страницы USERS_CREATE_NEW","","2026-07-02","passed","2026-07-02","","tests.ui.menu.MenuTest","tests.ui.menu.MenuTest","checkOpeningPage"
"Проверка создания нового пользователя","7127","Создание нового пользователя","","2026-07-02","passed","2026-07-02","","tests.ui.user.UserTest","tests.ui.user.UserTest","createUser"
"Проверка негативной авторизации с невалидными данными","3127","Негативная авторизация с некорректными кредами Негативный логин c email: test@test.com, password: test","","2026-07-02","passed","2026-07-02","","tests.ui.login.LoginTest","tests.ui.login.LoginTest","negativeLoginWith"
"Проверка начисления отрицательной суммы","2005","API - Попытка начисления денег пользователю, отрицательная сумма","","2026-07-02","passed","2026-07-02","","tests.api.user.UserApiTest","tests.api.user.UserApiTest","addInvalidMoneyToUser"
"Проверка получения списка автомобилей пользователя","4329","API - Получение списка автомобилей пользователя","","2026-07-02","passed","2026-07-02","","tests.api.user.UserApiTest","tests.api.user.UserApiTest","getUserCars"
"Параметризованный тест проверяет создание автомобиля с разными комбинациями марки, модели, типа двигателя и цены, а также последующее успешное удаление созданного автомобиля","1345","Создание и удаление автомобиля с различными параметрами Hyundai Elantra","","2026-07-02","passed","2026-07-02","","tests.api.car.CarApiTest","tests.api.car.CarApiTest","createAndDeleteCarTest"
"Проверка создания пользователя с невалидными данными","4981","Создание пользователя с невалидными данными Создание пользователя с невалидными данными - User(id=null, firstName=null, lastName=Stark, age=63, sex=FEMALE, money=928373.95)","","2026-07-02","passed","2026-07-02","","tests.ui.user.UserTest","tests.ui.user.UserTest","createInvalidUser"
"","689","API - Создание дома","","2026-07-02","passed","2026-07-02","","tests.api.allpost.AllPostApiTest","tests.api.allpost.AllPostApiTest","createHouse"
"Проверка негативной авторизации с невалидными данными","2985","Негативная авторизация с некорректными кредами Негативный логин c email: user@pflb.ru, password: test","","2026-07-02","passed","2026-07-02","","tests.ui.login.LoginTest","tests.ui.login.LoginTest","negativeLoginWith"
"Проверка открытия страницы ALL_DELETE","3330","Проверка открытия страницы ALL_DELETE","","2026-07-02","passed","2026-07-02","","tests.ui.menu.MenuTest","tests.ui.menu.MenuTest","openAllDelete"
"Тест проверяет множественную покупку автомобиля и сверяет статус код в каждой итерацииёё","7477","Проверка статуса после покупки","","2026-07-02","passed","2026-07-02","","tests.ui.car.BuyCarTest","tests.ui.car.BuyCarTest","checkStatusAfterPurchase"
"Проверка сортировки списка пользователей","32542","checkSortingByNumericField(String) Сортировка пользователей по полю Age","","2026-07-02","passed","2026-07-02","","tests.ui.user.UserTest","tests.ui.user.UserTest","checkSortingByNumericField"
"Создание нового дома с базовыми параметрами","14312","createSimpleHouse()","","2026-07-02","failed","2026-07-02","","tests.ui.house.HouseTest","tests.ui.house.HouseTest","createSimpleHouse"
"Параметризованный тест проверяет создание автомобиля с разными комбинациями марки, модели, типа двигателя и цены, а также последующее успешное удаление созданного автомобиля","1332","Создание и удаление автомобиля с различными параметрами Toyota Corolla","","2026-07-02","passed","2026-07-02","","tests.api.car.CarApiTest","tests.api.car.CarApiTest","createAndDeleteCarTest"
"Тест проверяет создание недорогого автомобиля (Lada Granta)","1397","Создание дешевого автомобиля","","2026-07-02","passed","2026-07-02","","tests.api.car.CarCrudTest","tests.api.car.CarCrudTest","createCheapCarTest"
"Удаление авто через страницу All DELETE с проверкой в БД","6321","UI - Удаление автомобиля через страницу All DELETE","","2026-07-02","passed","2026-07-02","","tests.ui.car.CarDeleteTest","tests.ui.car.CarDeleteTest","deleteCarThroughUI"
"Проверка сортировки списка пользователей","32213","checkSortingByNumericField(String) Сортировка пользователей по полю ID","","2026-07-02","passed","2026-07-02","","tests.ui.user.UserTest","tests.ui.user.UserTest","checkSortingByNumericField"
"Проверка удаления пользователя по id","2332","API - Удаление пользователя по id","","2026-07-02","passed","2026-07-02","","tests.api.user.UserApiTest","tests.api.user.UserApiTest","deleteUser"
"Тест проверяет создание автомобиля с водородным двигателем (Audi A4)","1346","Создание водородного автомобиля","","2026-07-02","passed","2026-07-02","","tests.api.car.CarCrudTest","tests.api.car.CarCrudTest","createPetrolCarTest"
"Проверка открытия страницы Read all houses и кнопки Reload","19119","testReadAllHousesPage()","","2026-07-02","passed","2026-07-02","","tests.ui.house.AllHousesTest","tests.ui.house.AllHousesTest","testReadAllHousesPage"
"","6110","All POST - создание дома","","2026-07-02","passed","2026-07-02","","tests.ui.allpost.AllPostTest","tests.ui.allpost.AllPostTest","createHouseFromAllPostPage"
"Тест проверяет создание немецкого автомобиля (Mercedes E200)","1357","Создание немецкого автомобиля","","2026-07-02","passed","2026-07-02","","tests.api.car.CarCrudTest","tests.api.car.CarCrudTest","createGermanCarTest"
"Проверка сообщения о некорректном вводе в поле password","2606","Ввод невалидных данных в поле 'email' Ввод невалидных данных в поле password: loremipsum","","2026-07-02","passed","2026-07-02","","tests.ui.login.LoginTest","tests.ui.login.LoginTest","validatePasswordInput"
"Проверка создания пользователя с невалидными данными","4908","Создание пользователя с невалидными данными Создание пользователя с невалидными данными - User(id=null, firstName=Lakita, lastName=Roberts, age=22, sex=FEMALE, money=null)","","2026-07-02","passed","2026-07-02","","tests.ui.user.UserTest","tests.ui.user.UserTest","createInvalidUser"
"","5523","All POST - начисление денег пользователю","","2026-07-02","passed","2026-07-02","","tests.ui.allpost.AllPostTest","tests.ui.allpost.AllPostTest","addMoneyFromAllPostPage"
"Проверка сортировки списка пользователей","32096","checkSortingByNumericField(String) Сортировка пользователей по полю Money","","2026-07-02","passed","2026-07-02","","tests.ui.user.UserTest","tests.ui.user.UserTest","checkSortingByNumericField"
"Проверка создания пользователя с невалидными данными","4961","Создание пользователя с невалидными данными Создание пользователя с невалидными данными - User(id=null, firstName=Marlene, lastName=Hermiston, age=null, sex=FEMALE, money=963750.33)","","2026-07-02","passed","2026-07-02","","tests.ui.user.UserTest","tests.ui.user.UserTest","createInvalidUser"
"","7391","Множественные покупки одним пользователем [1] 1","","2026-07-02","passed","2026-07-02","","tests.ui.car.BuyCarTest","tests.ui.car.BuyCarTest","multiplePurchasesByUser"
"Проверка переходов по основным разделам сайта","3262","checkOpeningPage(MenuOption) Проверка открытия страницы USERS_BUY_OR_SELL_CAR","","2026-07-02","passed","2026-07-02","","tests.ui.menu.MenuTest","tests.ui.menu.MenuTest","checkOpeningPage"
"Проверка получения пользователя по id","1677","API - Получение пользователя по id","","2026-07-02","passed","2026-07-02","","tests.api.user.UserApiTest","tests.api.user.UserApiTest","getUserById"
"Тест проверяет продажу автомобиля","8545","Продажа автомобиля пользователем","","2026-07-02","passed","2026-07-02","","tests.ui.car.SellCarTest","tests.ui.car.SellCarTest","sellCarSuccess"
"Проверка негативной авторизации с невалидными данными","3155","Негативная авторизация с некорректными кредами Негативный логин c email: test@test.com, password: user","","2026-07-02","passed","2026-07-02","","tests.ui.login.LoginTest","tests.ui.login.LoginTest","negativeLoginWith"
"Проверка удаления пользователя, проживающего в доме","4044","Попытка удаления пользователя, проживающего в доме","","2026-07-02","passed","2026-07-02","","tests.api.user.UserApiTest","tests.api.user.UserApiTest","deleteUserLiveInHouse"
"Удаление дома через страницу All DELETE с проверкой в БД","6425","UI - Удаление дома через страницу All DELETE","","2026-07-02","passed","2026-07-02","","tests.ui.house.HouseDeleteTest","tests.ui.house.HouseDeleteTest","deleteHouseThroughUI"
"","5307","UI - Удаление пользователя через страницу All DELETE","","2026-07-02","passed","2026-07-02","","tests.ui.user.UserTest","tests.ui.user.UserTest","deleteUserThroughUI"
"Тест проверяет создание электромобиля (Tesla Model3)","1386","Создание электрического автомобиля","","2026-07-02","passed","2026-07-02","","tests.api.car.CarCrudTest","tests.api.car.CarCrudTest","createElectricCarTest"
"Тест параметризованный тест на создание автомобиля","3043","Создание автомобилей с разными параметрами [1] CNG, Toyota, Camry, 100000","","2026-07-02","passed","2026-07-02","","tests.ui.car.CreateCarTest","tests.ui.car.CreateCarTest","createCarWithVariousData"
"","18721","checkSortingByTextField(String) Сортировка автомобилей по полю Model","","2026-07-02","passed","2026-07-02","","tests.ui.car.CarSortTest","tests.ui.car.CarSortTest","checkSortingByTextField"
"Тест проверяет создание и последующее изменение автомобиля, затем удаляет автомобиль","3585","Изменение автомобиля","","2026-07-02","passed","2026-07-02","","tests.api.car.CarCrudTest","tests.api.car.CarCrudTest","updateCarTest"
"Проверка открытия страницы ALL_POST","3476","Проверка открытия страницы ALL_POST","","2026-07-02","passed","2026-07-02","","tests.ui.menu.MenuTest","tests.ui.menu.MenuTest","openAllPost"
