"DESCRIPTION","DURATION IN MS","NAME","PARENT SUITE","START TIME","STATUS","STOP TIME","SUB SUITE","SUITE","TEST CLASS","TEST METHOD"
"","18758","checkSortingByTextField(String) Сортировка автомобилей по полю Model","","2026-07-01","passed","2026-07-01","","tests.ui.car.CarSortTest","tests.ui.car.CarSortTest","checkSortingByTextField"
"Параметризованный тест проверяет обработку ошибок при создании автомобиля с некорректными данными: пустые значения, недопустимые типы двигателя, отрицательная цена, числовые значения в строковых полях","337","Создание автомобиля с невалидными данными [6] , X5, Diesel, 10000","","2026-07-01","passed","2026-07-01","","tests.api.car.CarNegativeTest","tests.api.car.CarNegativeTest","createInvalidCarTest"
"Проверка успешной авторизации с валидными данными","3696","Успешная авторизация с корректными кредами","","2026-07-01","passed","2026-07-01","","tests.ui.login.LoginTest","tests.ui.login.LoginTest","successLogin"
"Проверка получения списка автомобилей пользователя","2343","API - Получение списка автомобилей пользователя","","2026-07-01","passed","2026-07-01","","tests.api.user.UserApiTest","tests.api.user.UserApiTest","getUserCars"
"Проверка получения списка пользователей","2200","API - Получение списка пользователей","","2026-07-01","passed","2026-07-01","","tests.api.user.UserApiTest","tests.api.user.UserApiTest","getUsers"
"Проверка начисления денег несуществующему пользователю","977","API - Попытка начисления денег несуществующему пользователю","","2026-07-01","passed","2026-07-01","","tests.api.user.UserApiTest","tests.api.user.UserApiTest","addMoneyToNotExistingUser"
"Проверка создания пользователя с невалидными данными","5478","Создание пользователя с невалидными данными Создание пользователя с невалидными данными - User(id=null, firstName=null, lastName=Morissette, age=51, sex=MALE, money=272288.28)","","2026-07-01","passed","2026-07-01","","tests.ui.user.UserTest","tests.ui.user.UserTest","createInvalidUser"
"","18162","checkSortingByFixedTextField(String) Сортировка автомобилей по полю Engine Type","","2026-07-01","passed","2026-07-01","","tests.ui.car.CarSortTest","tests.ui.car.CarSortTest","checkSortingByFixedTextField"
"Параметризованный тест проверяет создание автомобиля с разными комбинациями марки, модели, типа двигателя и цены, а также последующее успешное удаление созданного автомобиля","684","Создание и удаление автомобиля с различными параметрами Audi A4","","2026-07-01","passed","2026-07-01","","tests.api.car.CarApiTest","tests.api.car.CarApiTest","createAndDeleteCarTest"
"Проверка переходов по основным разделам сайта","3732","checkOpeningPage(MenuOption) Проверка открытия страницы USERS_BUY_OR_SELL_CAR","","2026-07-01","passed","2026-07-01","","tests.ui.menu.MenuTest","tests.ui.menu.MenuTest","checkOpeningPage"
"Проверка создания нового пользователя","674","API - Создание нового пользователя","","2026-07-01","passed","2026-07-01","","tests.api.user.UserApiTest","tests.api.user.UserApiTest","createUser"
"Тест проверяет создание нового автомобиля с валидными данными","6246","Создание нового автомобиля с валидными данными","","2026-07-01","passed","2026-07-01","","tests.ui.car.CreateCarTest","tests.ui.car.CreateCarTest","createCarWithValidData"
"","6213","All POST - выселение пользователя из дома","","2026-07-01","passed","2026-07-01","","tests.ui.allpost.AllPostTest","tests.ui.allpost.AllPostTest","evictUserFromHouseFromAllPostPage"
"Проверка получения списка автомобилей пользователя, у пользователя  несколько машин","9139","Получение списка автомобилей пользователя Получение списка автомобилей пользователя - машин у пользователя: 3","","2026-07-01","passed","2026-07-01","","tests.ui.user.UserTest","tests.ui.user.UserTest","readUserWithCars"
"Проверка начисления отрицательной суммы","1000","API - Попытка начисления денег пользователю, отрицательная сумма","","2026-07-01","passed","2026-07-01","","tests.api.user.UserApiTest","tests.api.user.UserApiTest","addInvalidMoneyToUser"
"","18481","checkSortingByNumericField(String) Сортировка автомобилей по полю Price","","2026-07-01","passed","2026-07-01","","tests.ui.car.CarSortTest","tests.ui.car.CarSortTest","checkSortingByNumericField"
"Проверка изменения несуществующего пользователя","1007","API - Попытка изменения несуществующего пользователя","","2026-07-01","passed","2026-07-01","","tests.api.user.UserApiTest","tests.api.user.UserApiTest","changeNotExistingUserById"
"Проверка негативной авторизации с невалидными данными","3601","Негативная авторизация с некорректными кредами Негативный логин c email: user@pflb.ru, password: test","","2026-07-01","passed","2026-07-01","","tests.ui.login.LoginTest","tests.ui.login.LoginTest","negativeLoginWith"
"Проверка переходов по основным разделам сайта","3706","checkOpeningPage(MenuOption) Проверка открытия страницы CARS_BUY_OR_SELL_CAR","","2026-07-01","passed","2026-07-01","","tests.ui.menu.MenuTest","tests.ui.menu.MenuTest","checkOpeningPage"
"","18489","checkSortingByNumericField(String) Сортировка автомобилей по полю ID","","2026-07-01","passed","2026-07-01","","tests.ui.car.CarSortTest","tests.ui.car.CarSortTest","checkSortingByNumericField"
"","6061","All POST - создание пользователя","","2026-07-01","passed","2026-07-01","","tests.ui.allpost.AllPostTest","tests.ui.allpost.AllPostTest","createUserFromAllPostPage"
"Проверка создания пользователя с невалидными данными","329","API - Создание пользователя с невалидными данными Создание пользователя с невалидными данными - UserRq(id=null, age=48, firstName=Rayford, money=null, secondName=Mayert, sex=MALE)","","2026-07-01","passed","2026-07-01","","tests.api.user.UserApiTest","tests.api.user.UserApiTest","createUserWithNullFields"
"Тест проверяет продажу нескольких автомобилей одним пользователем","17568","Множественная продажа автомобилей одним пользователем [3] 3","","2026-07-01","passed","2026-07-01","","tests.ui.car.SellCarTest","tests.ui.car.SellCarTest","multipleSalesByUser"
"Тест проверяет возможность покупки несуществующего автомобиля","5252","Ошибка при попытке купить несуществующий автомобиль","","2026-07-01","passed","2026-07-01","","tests.ui.car.BuyCarTest","tests.ui.car.BuyCarTest","buyNonExistentCar"
"Проверка сортировки списка пользователей","28697","checkSortingByTextField(String) Сортировка пользователей по полю First name","","2026-07-01","passed","2026-07-01","","tests.ui.user.UserTest","tests.ui.user.UserTest","checkSortingByTextField"
"Проверка удаления пользователя по id","1860","API - Удаление пользователя по id","","2026-07-01","passed","2026-07-01","","tests.api.user.UserApiTest","tests.api.user.UserApiTest","deleteUser"
"Тест проверяет создание электромобиля (Tesla Model3)","682","Создание электрического автомобиля","","2026-07-01","passed","2026-07-01","","tests.api.car.CarCrudTest","tests.api.car.CarCrudTest","createElectricCarTest"
"Тест проверяет создание автомобиля с дизельным двигателем (BMW X5)","667","Создание дизельного автомобиля","","2026-07-01","passed","2026-07-01","","tests.api.car.CarCrudTest","tests.api.car.CarCrudTest","createDieselCarTest"
"Проверка получения списка автомобилей пользователя, у пользователя  несколько машин","6533","Получение списка автомобилей пользователя Получение списка автомобилей пользователя - машин у пользователя: 1","","2026-07-01","passed","2026-07-01","","tests.ui.user.UserTest","tests.ui.user.UserTest","readUserWithCars"
"Тест проверяет попытку продажи с недействительным ID пользователя","7603","Ошибка при продаже с недействительным ID пользователя","","2026-07-01","passed","2026-07-01","","tests.ui.car.SellCarTest","tests.ui.car.SellCarTest","sellCarWithInvalidUserId"
"Проверка выдачи кредита пользователю","0","Выдача кредита пользователю","","2026-07-01","skipped","2026-07-01","","tests.ui.user.UserTest","tests.ui.user.UserTest","issueALoan"
"Проверка получения имущества пользователя","1990","API - Получение имущества пользователя","","2026-07-01","passed","2026-07-01","","tests.api.user.UserApiTest","tests.api.user.UserApiTest","getUserInfo"
"Проверка создания нового пользователя","7429","Создание нового пользователя","","2026-07-01","passed","2026-07-01","","tests.ui.user.UserTest","tests.ui.user.UserTest","createUser"
"Проверка получения несуществующего пользователя","990","API - Попытка получения несуществующего пользователя по id","","2026-07-01","passed","2026-07-01","","tests.api.user.UserApiTest","tests.api.user.UserApiTest","getNotExistingUserById"
"Проверка открытия страницы ALL_DELETE","3783","Проверка открытия страницы ALL_DELETE","","2026-07-01","passed","2026-07-01","","tests.ui.menu.MenuTest","tests.ui.menu.MenuTest","openAllDelete"
"Тест проверяет создание дорогого электромобиля (Tesla ModelX)","657","Создание дорогого автомобиля","","2026-07-01","passed","2026-07-01","","tests.api.car.CarCrudTest","tests.api.car.CarCrudTest","createExpensiveCarTest"
"Проверка сообщения о некорректном вводе в поле password","2773","Ввод невалидных данных в поле 'email' Ввод невалидных данных в поле password: loremipsum","","2026-07-01","passed","2026-07-01","","tests.ui.login.LoginTest","tests.ui.login.LoginTest","validatePasswordInput"
"Проверка сортировки списка пользователей","28934","checkSortingByTextField(String) Сортировка пользователей по полю Last name","","2026-07-01","passed","2026-07-01","","tests.ui.user.UserTest","tests.ui.user.UserTest","checkSortingByTextField"
"","6094","All POST - создание пользователя женского пола","","2026-07-01","passed","2026-07-01","","tests.ui.allpost.AllPostTest","tests.ui.allpost.AllPostTest","createFemaleUserFromAllPostPage"
"Проверка отмены успешной авторизации с валидными данными","3461","Негативная авторизация с корректными кредами","","2026-07-01","passed","2026-07-01","","tests.ui.login.LoginTest","tests.ui.login.LoginTest","negativeLogin"
"Тест проверяет продажу нескольких автомобилей одним пользователем","8679","Множественная продажа автомобилей одним пользователем [1] 1","","2026-07-01","passed","2026-07-01","","tests.ui.car.SellCarTest","tests.ui.car.SellCarTest","multipleSalesByUser"
"Проверка создания пользователя с невалидными данными","5398","Создание пользователя с невалидными данными Создание пользователя с невалидными данными - User(id=null, firstName=Melva, lastName=null, age=82, sex=FEMALE, money=277645.25)","","2026-07-01","passed","2026-07-01","","tests.ui.user.UserTest","tests.ui.user.UserTest","createInvalidUser"
"","11119","Множественные покупки одним пользователем [2] 2","","2026-07-01","passed","2026-07-01","","tests.ui.car.BuyCarTest","tests.ui.car.BuyCarTest","multiplePurchasesByUser"
"Проверка переходов по основным разделам сайта","3749","checkOpeningPage(MenuOption) Проверка открытия страницы USERS_ISSUE_LOAN","","2026-07-01","passed","2026-07-01","","tests.ui.menu.MenuTest","tests.ui.menu.MenuTest","checkOpeningPage"
"","7773","Множественные покупки одним пользователем [1] 1","","2026-07-01","passed","2026-07-01","","tests.ui.car.BuyCarTest","tests.ui.car.BuyCarTest","multiplePurchasesByUser"
"Тест параметризованный тест на создание автомобиля","3596","Создание автомобилей с разными параметрами [1] CNG, Toyota, Camry, 100000","","2026-07-01","passed","2026-07-01","","tests.ui.car.CreateCarTest","tests.ui.car.CreateCarTest","createCarWithVariousData"
"Тест проверяет создание и последующее удаление автомобиля","671","Удаление автомобиля","","2026-07-01","passed","2026-07-01","","tests.api.car.CarCrudTest","tests.api.car.CarCrudTest","deleteCarTest"
"Проверка открытия страницы ALL_POST","4069","Проверка открытия страницы ALL_POST","","2026-07-01","passed","2026-07-01","","tests.ui.menu.MenuTest","tests.ui.menu.MenuTest","openAllPost"
"Тест проверяет создание и последующее изменение автомобиля, затем удаляет автомобиль","2550","Изменение автомобиля","","2026-07-01","passed","2026-07-01","","tests.api.car.CarCrudTest","tests.api.car.CarCrudTest","updateCarTest"
"Параметризованный тест проверяет обработку ошибок при создании автомобиля с некорректными данными: пустые значения, недопустимые типы двигателя, отрицательная цена, числовые значения в строковых полях","330","Создание автомобиля с невалидными данными [7] 123, X5, Diesel, 10000","","2026-07-01","passed","2026-07-01","","tests.api.car.CarNegativeTest","tests.api.car.CarNegativeTest","createInvalidCarTest"
"Удаление дома через страницу All DELETE с проверкой в БД","6614","UI - Удаление дома через страницу All DELETE","","2026-07-01","passed","2026-07-01","","tests.ui.house.HouseDeleteTest","tests.ui.house.HouseDeleteTest","deleteHouseThroughUI"
"Тест проверяет создание автомобиля, его получение по ID и последующее удаление","1000","Получение автомобиля по ID","","2026-07-01","passed","2026-07-01","","tests.api.car.CarCrudTest","tests.api.car.CarCrudTest","getCarTest"
"Проверка сообщения о некорректном вводе в поле email","2780","Ввод невалидных данных в поле 'email' Ввод невалидных данных в поле email: test.com","","2026-07-01","passed","2026-07-01","","tests.ui.login.LoginTest","tests.ui.login.LoginTest","validateEmailInput"
"Тест проверяет создание японского автомобиля (Toyota Camry)","668","Создание японского автомобиля","","2026-07-01","passed","2026-07-01","","tests.api.car.CarCrudTest","tests.api.car.CarCrudTest","createJapaneseCarTest"
"Тест проверяет покупку автомобиля с недостаточными средствами","7652","Ошибка при покупке с недостаточными средствами","","2026-07-01","passed","2026-07-01","","tests.ui.car.BuyCarTest","tests.ui.car.BuyCarTest","buyCarWithInsufficientMoney"
"Проверка получения списка автомобилей пользователя, у пользователя  несколько машин","11873","Получение списка автомобилей пользователя Получение списка автомобилей пользователя - машин у пользователя: 5","","2026-07-01","passed","2026-07-01","","tests.ui.user.UserTest","tests.ui.user.UserTest","readUserWithCars"
"","6077","All POST - покупка автомобиля","","2026-07-01","passed","2026-07-01","","tests.ui.allpost.AllPostTest","tests.ui.allpost.AllPostTest","buyOrSellCarFromAllPostPage"
"Проверка удаления пользователя, проживающего в доме","2018","Попытка удаления пользователя, проживающего в доме","","2026-07-01","passed","2026-07-01","","tests.api.user.UserApiTest","tests.api.user.UserApiTest","deleteUserLiveInHouse"
"Проверка сортировки списка пользователей","32713","checkSortingByNumericField(String) Сортировка пользователей по полю Money","","2026-07-01","passed","2026-07-01","","tests.ui.user.UserTest","tests.ui.user.UserTest","checkSortingByNumericField"
"","6953","All POST - продажа автомобиля","","2026-07-01","passed","2026-07-01","","tests.ui.allpost.AllPostTest","tests.ui.allpost.AllPostTest","sellCarFromAllPostPage"
"Проверка переходов по основным разделам сайта","3873","checkOpeningPage(MenuOption) Проверка открытия страницы CARS_CREATE_NEW","","2026-07-01","passed","2026-07-01","","tests.ui.menu.MenuTest","tests.ui.menu.MenuTest","checkOpeningPage"
"Параметризованный тест проверяет обработку ошибок при создании автомобиля с некорректными данными: пустые значения, недопустимые типы двигателя, отрицательная цена, числовые значения в строковых полях","334","Создание автомобиля с невалидными данными [5] BMW, X5, Diesel, -100","","2026-07-01","passed","2026-07-01","","tests.api.car.CarNegativeTest","tests.api.car.CarNegativeTest","createInvalidCarTest"
"Параметризованный тест проверяет обработку ошибок при создании автомобиля с некорректными данными: пустые значения, недопустимые типы двигателя, отрицательная цена, числовые значения в строковых полях","342","Создание автомобиля с невалидными данными [3] BMW, X5, null, 10000","","2026-07-01","passed","2026-07-01","","tests.api.car.CarNegativeTest","tests.api.car.CarNegativeTest","createInvalidCarTest"
"","701","Получение дома по ID","","2026-07-01","passed","2026-07-01","","tests.api.house.HouseCrudTest","tests.api.house.HouseCrudTest","getHouseTest"
"","3826","All POST - отображение всех POST-форм","","2026-07-01","passed","2026-07-01","","tests.ui.allpost.AllPostTest","tests.ui.allpost.AllPostTest","checkAllPost"
"Параметризованный тест проверяет обработку ошибок при создании автомобиля с некорректными данными: пустые значения, недопустимые типы двигателя, отрицательная цена, числовые значения в строковых полях","334","Создание автомобиля с невалидными данными [8] BMW, 123, Diesel, 10000","","2026-07-01","passed","2026-07-01","","tests.api.car.CarNegativeTest","tests.api.car.CarNegativeTest","createInvalidCarTest"
"Проверка переходов по основным разделам сайта","3751","checkOpeningPage(MenuOption) Проверка открытия страницы USERS_READ_WITH_CARS","","2026-07-01","passed","2026-07-01","","tests.ui.menu.MenuTest","tests.ui.menu.MenuTest","checkOpeningPage"
"Тест проверяет создание немецкого автомобиля (Mercedes E200)","667","Создание немецкого автомобиля","","2026-07-01","passed","2026-07-01","","tests.api.car.CarCrudTest","tests.api.car.CarCrudTest","createGermanCarTest"
"","18998","checkSortingByTextField(String) Сортировка автомобилей по полю Mark","","2026-07-01","passed","2026-07-01","","tests.ui.car.CarSortTest","tests.ui.car.CarSortTest","checkSortingByTextField"
"Проверка создания пользователя с невалидными данными","5444","Создание пользователя с невалидными данными Создание пользователя с невалидными данными - User(id=null, firstName=Claude, lastName=Smith, age=74, sex=null, money=115269.66)","","2026-07-01","passed","2026-07-01","","tests.ui.user.UserTest","tests.ui.user.UserTest","createInvalidUser"
"Тест параметризованный тест на создание автомобиля","3448","Создание автомобилей с разными параметрами [3] Gasoline, Mercedes, E-Class, 250000","","2026-07-01","passed","2026-07-01","","tests.ui.car.CreateCarTest","tests.ui.car.CreateCarTest","createCarWithVariousData"
"","1466","API - Заселение и выселение пользователя из дома","","2026-07-01","passed","2026-07-01","","tests.api.allpost.AllPostApiTest","tests.api.allpost.AllPostApiTest","settleAndEvictUserInHouse"
"Проверка удаления пользователя, у которого есть машина","2351","Попытка удаления пользователя, у которого есть машина","","2026-07-01","passed","2026-07-01","","tests.api.user.UserApiTest","tests.api.user.UserApiTest","deleteUserHavingCar"
"Проверка начисления денег пользователю","1054","API - Начисление денег пользователю","","2026-07-01","passed","2026-07-01","","tests.api.user.UserApiTest","tests.api.user.UserApiTest","addMoneyToUser"
"Создание нового дома с базовыми параметрами","14823","createSimpleHouse()","","2026-07-01","failed","2026-07-01","","tests.ui.house.HouseTest","tests.ui.house.HouseTest","createSimpleHouse"
"Параметризованный тест проверяет обработку ошибок при создании автомобиля с некорректными данными: пустые значения, недопустимые типы двигателя, отрицательная цена, числовые значения в строковых полях","334","Создание автомобиля с невалидными данными [2] BMW, null, Diesel, 10000","","2026-07-01","passed","2026-07-01","","tests.api.car.CarNegativeTest","tests.api.car.CarNegativeTest","createInvalidCarTest"
"Проверка открытия страницы Read all houses и кнопки Reload","24081","testReadAllHousesPage()","","2026-07-01","passed","2026-07-01","","tests.ui.house.AllHousesTest","tests.ui.house.AllHousesTest","testReadAllHousesPage"
"","1268","Изменение дома","","2026-07-01","passed","2026-07-01","","tests.api.house.HouseCrudTest","tests.api.house.HouseCrudTest","updateHouseTest"
